{
  "artifact_type": "skill",
  "audit_status": "reviewed",
  "canonical_name": "fixing-motion-performance",
  "commands": [
    "stack.qa"
  ],
  "context": {
    "inputs": [
      "request",
      "workspace-context"
    ],
    "outputs": [
      "capability-result"
    ]
  },
  "disposition": {
    "evidence_gap": null,
    "next_review_trigger": "Reassess on source, export, or runtime-target change.",
    "status": "keep"
  },
  "domain": "qa",
  "family": "qa",
  "lifecycle": "active",
  "overlaps": [],
  "ownership": {
    "package": "imported-skills",
    "provider": "ui",
    "source_path": "skills/imported/ui/fixing-motion-performance/SKILL.md"
  },
  "provenance": {
    "license": "unknown",
    "posture": "repository-local",
    "source_identity": "stack:skills/ui-skills/fixing-motion-performance"
  },
  "purpose": "Audit and fix animation performance issues including layout thrashing, compositor properties, scroll-linked motion, and blur effects. Use when animations stutter, transitions jank, or reviewing CSS/JS animation performance.",
  "role": "leaf",
  "runtimes": {
    "publish_targets": [
      "claude",
      "codex"
    ],
    "supported": [
      "claude",
      "codex"
    ]
  },
  "schema_version": 1,
  "source": {
    "skill_path": "skills/imported/ui/fixing-motion-performance/SKILL.md"
  },
  "trust_class": "read-only",
  "validation": {
    "evidence": [
      "reviewed-estate-refactor",
      "structural-classification",
      "primary-runtime-parity"
    ],
    "status": "validated"
  },
  "validation_class": "representative-route",
  "visibility": "extended"
}
