{
  "artifact_type": "skill",
  "audit_status": "reviewed",
  "canonical_name": "arrange",
  "commands": [
    "stack.build"
  ],
  "context": {
    "inputs": [
      "request",
      "workspace-context"
    ],
    "outputs": [
      "capability-result"
    ]
  },
  "disposition": {
    "evidence_gap": null,
    "next_review_trigger": "Reassess on source, export, or runtime-target change.",
    "status": "keep"
  },
  "domain": "engineering",
  "family": "engineering",
  "lifecycle": "active",
  "overlaps": [],
  "ownership": {
    "package": "imported-skills",
    "provider": "impeccable",
    "source_path": "skills/imported/impeccable/arrange/SKILL.md"
  },
  "provenance": {
    "license": "unknown",
    "posture": "repository-local",
    "source_identity": "stack:skills/impeccable/arrange"
  },
  "purpose": "Improve layout, spacing, and visual rhythm. Fixes monotonous grids, inconsistent spacing, and weak visual hierarchy to create intentional compositions.",
  "role": "leaf",
  "runtimes": {
    "publish_targets": [
      "claude",
      "codex"
    ],
    "supported": [
      "claude",
      "codex"
    ]
  },
  "schema_version": 1,
  "source": {
    "skill_path": "skills/imported/impeccable/arrange/SKILL.md"
  },
  "trust_class": "local-mutation",
  "validation": {
    "evidence": [
      "reviewed-estate-refactor",
      "structural-classification",
      "primary-runtime-parity"
    ],
    "status": "validated"
  },
  "validation_class": "representative-route",
  "visibility": "extended"
}
