{
  "artifact_type": "skill",
  "audit_status": "reviewed",
  "canonical_name": "matt-research",
  "commands": [
    "stack.learn"
  ],
  "context": {
    "inputs": [
      "request",
      "workspace-context"
    ],
    "outputs": [
      "capability-result"
    ]
  },
  "disposition": {
    "evidence_gap": null,
    "next_review_trigger": "Reassess on source, export, or runtime-target change.",
    "status": "keep"
  },
  "domain": "knowledge",
  "family": "knowledge",
  "lifecycle": "active",
  "overlaps": [],
  "ownership": {
    "package": "imported-skills",
    "provider": "matt",
    "source_path": "skills/imported/matt/matt-research/SKILL.md"
  },
  "provenance": {
    "license": "unknown",
    "posture": "imported-upstream",
    "source_identity": "upstream:skills/matt-research"
  },
  "purpose": "Namespaced import of Matt Pocock engineering/productivity skills: Investigate",
  "role": "leaf",
  "runtimes": {
    "publish_targets": [
      "claude",
      "codex"
    ],
    "supported": [
      "claude",
      "codex"
    ]
  },
  "schema_version": 1,
  "source": {
    "skill_path": "skills/imported/matt/matt-research/SKILL.md"
  },
  "trust_class": "read-only",
  "validation": {
    "evidence": [
      "reviewed-estate-refactor",
      "structural-classification",
      "primary-runtime-parity"
    ],
    "status": "validated"
  },
  "validation_class": "representative-route",
  "visibility": "extended"
}
