{
  "artifact_type": "skill",
  "audit_status": "reviewed",
  "canonical_name": "make-interfaces-feel-better",
  "commands": [
    "stack.design"
  ],
  "context": {
    "inputs": [
      "request",
      "workspace-context"
    ],
    "outputs": [
      "capability-result"
    ]
  },
  "disposition": {
    "evidence_gap": null,
    "next_review_trigger": "Reassess on source, export, or runtime-target change.",
    "status": "keep"
  },
  "domain": "design",
  "family": "design",
  "lifecycle": "active",
  "overlaps": [],
  "ownership": {
    "package": "stack",
    "provider": "stack",
    "source_path": "skills/design/make-interfaces-feel-better/SKILL.md"
  },
  "provenance": {
    "license": "unknown",
    "posture": "repository-local",
    "source_identity": "stack:skills/make-interfaces-feel-better"
  },
  "purpose": "Design engineering principles for making interfaces feel polished. Use when building UI components, reviewing frontend code, implementing animations, hover states, shadows, borders, typography, micro-interactions, enter/exit animations, or any visual detail work. Triggers on UI polish, design details, \"make it feel better\", \"feels off\", stagger animations, border radius, optical alignment, font smoothing, tabular numbers, image outlines, box shadows.",
  "role": "leaf",
  "runtimes": {
    "publish_targets": [
      "claude",
      "codex"
    ],
    "supported": [
      "claude",
      "codex"
    ]
  },
  "schema_version": 1,
  "source": {
    "skill_path": "skills/design/make-interfaces-feel-better/SKILL.md"
  },
  "trust_class": "read-only",
  "validation": {
    "evidence": [
      "reviewed-estate-refactor",
      "structural-classification",
      "primary-runtime-parity"
    ],
    "status": "validated"
  },
  "validation_class": "representative-route",
  "visibility": "extended"
}
