{
  "alias_of": "deslop",
  "artifact_type": "skill",
  "audit_status": "reviewed",
  "canonical_name": "cdo-deslop",
  "commands": [
    "stack.design"
  ],
  "context": {
    "inputs": [
      "request",
      "workspace-context"
    ],
    "outputs": [
      "capability-result"
    ]
  },
  "disposition": {
    "evidence_gap": null,
    "next_review_trigger": "Remove only after compatibility retirement review.",
    "status": "merge"
  },
  "domain": "design",
  "family": "design",
  "lifecycle": "deprecated",
  "overlaps": [
    "deslop"
  ],
  "ownership": {
    "package": "stack",
    "provider": "stack",
    "source_path": "skills/design/cdo/deslop/SKILL.md"
  },
  "provenance": {
    "license": "unknown",
    "posture": "repository-local",
    "source_identity": "stack:skills/cdo/deslop"
  },
  "purpose": "Remove AI-generated code slop from the current branch. Use after writing code to clean up unnecessary comments, defensive checks, and inconsistent style.",
  "role": "alias",
  "runtimes": {
    "publish_targets": [
      "claude",
      "codex"
    ],
    "supported": [
      "claude",
      "codex"
    ]
  },
  "schema_version": 1,
  "source": {
    "skill_path": "skills/design/cdo/deslop/SKILL.md"
  },
  "trust_class": "read-only",
  "validation": {
    "evidence": [
      "reviewed-estate-refactor",
      "structural-classification"
    ],
    "status": "validated"
  },
  "validation_class": "representative-route",
  "visibility": "compatibility"
}
