{
  "artifact_type": "skill",
  "audit_status": "reviewed",
  "canonical_name": "emil-design-eng",
  "commands": [
    "stack.design"
  ],
  "context": {
    "inputs": [
      "request",
      "workspace-context"
    ],
    "outputs": [
      "capability-result"
    ]
  },
  "disposition": {
    "evidence_gap": null,
    "next_review_trigger": "Reassess on source, export, or runtime-target change.",
    "status": "keep"
  },
  "domain": "design",
  "family": "design",
  "lifecycle": "active",
  "overlaps": [],
  "ownership": {
    "package": "imported-skills",
    "provider": "emil",
    "source_path": "skills/imported/emil/emil-design-eng/SKILL.md"
  },
  "provenance": {
    "license": "unknown",
    "posture": "repository-local",
    "source_identity": "stack:skills/emil-design-eng"
  },
  "purpose": "This skill encodes Emil Kowalski's philosophy on UI polish, component design, animation decisions, and the invisible details that make software feel great.",
  "role": "leaf",
  "runtimes": {
    "publish_targets": [
      "claude",
      "codex"
    ],
    "supported": [
      "claude",
      "codex"
    ]
  },
  "schema_version": 1,
  "source": {
    "skill_path": "skills/imported/emil/emil-design-eng/SKILL.md"
  },
  "trust_class": "read-only",
  "validation": {
    "evidence": [
      "reviewed-estate-refactor",
      "structural-classification",
      "primary-runtime-parity"
    ],
    "status": "validated"
  },
  "validation_class": "representative-route",
  "visibility": "extended"
}
