{
  "artifact_type": "skill",
  "audit_status": "reviewed",
  "canonical_name": "favicon",
  "commands": [
    "stack.design"
  ],
  "context": {
    "inputs": [
      "request",
      "workspace-context"
    ],
    "outputs": [
      "capability-result"
    ]
  },
  "disposition": {
    "evidence_gap": null,
    "next_review_trigger": "Reassess on source, export, or runtime-target change.",
    "status": "keep"
  },
  "domain": "design",
  "family": "design",
  "lifecycle": "active",
  "overlaps": [],
  "ownership": {
    "package": "stack",
    "provider": "stack",
    "source_path": "skills/design/cdo/favicon/SKILL.md"
  },
  "provenance": {
    "license": "unknown",
    "posture": "repository-local",
    "source_identity": "stack:skills/cdo/favicon"
  },
  "purpose": "Generate a complete set of favicons from a source image and update HTML. Use when setting up favicons for a web project.",
  "role": "leaf",
  "runtimes": {
    "publish_targets": [
      "claude",
      "codex"
    ],
    "supported": [
      "claude",
      "codex"
    ]
  },
  "schema_version": 1,
  "source": {
    "skill_path": "skills/design/cdo/favicon/SKILL.md"
  },
  "trust_class": "read-only",
  "validation": {
    "evidence": [
      "reviewed-estate-refactor",
      "structural-classification",
      "primary-runtime-parity"
    ],
    "status": "validated"
  },
  "validation_class": "representative-route",
  "visibility": "extended"
}
