{
  "artifact_type": "skill",
  "audit_status": "reviewed",
  "canonical_name": "cdo-taste-skill",
  "commands": [
    "stack.design"
  ],
  "compatibility_aliases": [
    "taste-skill-suite-taste-skill"
  ],
  "context": {
    "inputs": [
      "request",
      "workspace-context"
    ],
    "outputs": [
      "capability-result"
    ]
  },
  "disposition": {
    "evidence_gap": null,
    "next_review_trigger": "Reassess on source, export, or runtime-target change.",
    "status": "keep"
  },
  "domain": "design",
  "family": "design",
  "lifecycle": "active",
  "overlaps": [
    "taste-skill-suite-taste-skill"
  ],
  "ownership": {
    "package": "stack",
    "provider": "stack",
    "source_path": "skills/design/cdo/taste-skill/SKILL.md"
  },
  "provenance": {
    "license": "unknown",
    "posture": "repository-local",
    "source_identity": "stack:skills/cdo/taste-skill+skills/taste-skill-suite/taste-skill"
  },
  "purpose": "Senior UI/UX Engineer. Architect digital interfaces overriding default LLM biases. Enforces metric-based rules, strict component architecture, CSS hardware acceleration, and balanced design engineering.",
  "role": "leaf",
  "runtimes": {
    "publish_targets": [
      "claude",
      "codex"
    ],
    "supported": [
      "claude",
      "codex"
    ]
  },
  "schema_version": 1,
  "source": {
    "skill_path": "skills/design/cdo/taste-skill/SKILL.md"
  },
  "trust_class": "read-only",
  "validation": {
    "evidence": [
      "reviewed-estate-refactor",
      "structural-classification",
      "primary-runtime-parity"
    ],
    "status": "validated"
  },
  "validation_class": "representative-route",
  "visibility": "extended"
}
