{
  "artifact_type": "skill",
  "audit_status": "reviewed",
  "canonical_name": "field-theory-bookmark-synthesis",
  "commands": [
    "stack.learn"
  ],
  "context": {
    "inputs": [
      "request",
      "workspace-context"
    ],
    "outputs": [
      "capability-result"
    ]
  },
  "disposition": {
    "evidence_gap": null,
    "next_review_trigger": "Reassess on source, export, or runtime-target change.",
    "status": "keep"
  },
  "domain": "knowledge",
  "family": "knowledge",
  "lifecycle": "active",
  "overlaps": [],
  "ownership": {
    "package": "stack",
    "provider": "stack",
    "source_path": "skills/knowledge/field-theory-bookmark-synthesis/SKILL.md"
  },
  "provenance": {
    "license": "unknown",
    "posture": "repository-local",
    "source_identity": "stack:skills/field-theory-bookmark-synthesis"
  },
  "purpose": "Classify and synthesize Maroun's Field Theory bookmark batches into grounded domains, categories, and operating-pattern summaries. Use for recent bookmark clusters, X/Field Theory exports, domain overview drafts, category summaries, adoption recommendations, and read-only source-count/provenance reporting.",
  "role": "leaf",
  "runtimes": {
    "publish_targets": [
      "claude",
      "codex"
    ],
    "supported": [
      "claude",
      "codex"
    ]
  },
  "schema_version": 1,
  "source": {
    "skill_path": "skills/knowledge/field-theory-bookmark-synthesis/SKILL.md"
  },
  "trust_class": "read-only",
  "validation": {
    "evidence": [
      "reviewed-estate-refactor",
      "structural-classification",
      "primary-runtime-parity"
    ],
    "status": "validated"
  },
  "validation_class": "representative-route",
  "visibility": "extended"
}
